coordinates,created_at,hashtags,media,urls,favorite_count,id,in_reply_to_screen_name,in_reply_to_status_id,in_reply_to_user_id,lang,place,possibly_sensitive,retweet_count,reweet_id,retweet_screen_name,source,text,tweet_url,user_created_at,user_screen_name,user_default_profile_image,user_description,user_favourites_count,user_followers_count,user_friends_count,user_listed_count,user_location,user_name,user_screen_name,user_statuses_count,user_time_zone,user_urls,user_verified
"8.88212637,38.90783341",Mon Jul 13 06:07:46 +0000 2020,streetsofcovid_19 beforeandaftercovid_19 covid_19 staysafe lifeincolor socialdistancing igers igersitalia igersardegna,,https://www.instagram.com/p/CCklZgkAXNj/?igshid=wwwq3wu8eb39,0,1282557311559573505,,,,en,"Domus de Maria, Sardinia",false,0,,,"<a href=""http://instagram.com"" rel=""nofollow"">Instagram</a>","Photo project:
Before and after covid_19

Title: 
""Driving"" directions

#streetsofcovid_19 #beforeandaftercovid_19
@Ale_Treglia

#covid_19 #staysafe #lifeincolor #socialdistancing 
#igers #igersitalia #igersardegna… https://t.co/ZG7p06Gb9z",https://twitter.com/Ale_Treglia/status/1282557311559573505,Fri Mar 23 14:35:30 +0000 2012,Ale_Treglia,false,"Photographer + photography courses teacher.
Available on assignment.",1483,62,147,6,Italy,Alessandro Treglia,Ale_Treglia,1001,,https://www.instagram.com/ale.treglia/,false
"-118.443236,34.151337",Mon Jul 13 05:08:25 +0000 2020,luxury california villa forsale realestate,,https://www.instagram.com/p/CCkemwIjGAq/?igshid=1a58d35c5lp0r,1,1282542374875430918,,,,en,"Los Angeles, CA",false,0,,,"<a href=""http://instagram.com"" rel=""nofollow"">Instagram</a>",Showing this beauty - stunning gated estate w pool and guesthouse. Valued at over $3mm. Contact for info. COVID-19 protocols to be observed during showings. #luxury #california #villa #forsale #realestate… https://t.co/37AsTM0AMZ,https://twitter.com/russiankat/status/1282542374875430918,Tue Apr 21 21:52:43 +0000 2009,russiankat,false,"I am a Real Estate Investment Planner in Los Angeles, selling multi-family and residential properties in the US",98,71,227,2,Beverly Hills,Ekaterina,russiankat,681,,,false
"151.2125,-33.8852",Mon Jul 13 04:36:36 +0000 2020,faceid covid19,,https://www.instagram.com/p/CCka6O4n1jv/?igshid=1xxm98kq1bxya,0,1282534370474102784,,,,en,"Sydney, New South Wales",false,0,,,"<a href=""http://instagram.com"" rel=""nofollow"">Instagram</a>","Wear your mask despite #faceid #covid19 @ Surry Hills, New South Wales, Australia https://t.co/RBj6aX1A2g",https://twitter.com/HikaruFreeman/status/1282534370474102784,Thu Apr 30 04:34:54 +0000 2009,HikaruFreeman,false,🇺🇸🇳🇿 living in NSW. 🏳️‍🌈Playwright/Scriptwriter. Polyglot. Very amateur bodybuilder. Neurodiverse. Personal account. He/him,2303,972,2596,21,"Redfern, Sydney",Hikaru Freeman,HikaruFreeman,15850,,,false
"-73.47935661,45.6677507",Mon Jul 13 04:47:01 +0000 2020,,,http://dlvr.it/RbVBDD,0,1282536991062515713,,,,en,"Varennes, Québec",false,0,,,"<a href=""https://dlvrit.com/"" rel=""nofollow"">dlvr.it</a>","Fighting Stigma : Report underlines impact of pandemic on children taken into care: The plight of parents who were unable to visit their seriously ill child, who had ... The latest bulletin from the Child Care Law Reporting Project (CCLRP) ... bodies… https://t.co/67ajh1mJxq",https://twitter.com/pairsonnalitesN/status/1282536991062515713,Wed Sep 15 15:55:47 +0000 2010,pairsonnalitesN,false,Ireland — Scotland — Inuit —  Svenska  | Keeping up-to-date on global exclusion — Stigmabase is a canadian internet non-profit Initiative,0,1484,1328,108,Ireland | Scotland | Inuit | Skandinavien,Stigmabase | NORDIC,pairsonnalitesN,787710,,https://edu.stigmabase.org/,false
"27.9667,-26.05",Mon Jul 13 05:17:28 +0000 2020,WisdomMonday,,https://www.instagram.com/p/CCkfpPODg0r/?igshid=7yjo0pii62u0,0,1282544654685294592,,,,en,"Randburg, South Africa",false,1,,,"<a href=""http://instagram.com"" rel=""nofollow"">Instagram</a>","#WisdomMonday🥰

Keep the social distancing, practice COVID-19 prevention measures, invest in your total health going forward... that is your insurance and wealth... @ Sandton, Gauteng https://t.co/WaO6oM3Gs0",https://twitter.com/fundilen/status/1282544654685294592,Mon Nov 08 09:05:02 +0000 2010,fundilen,false,"Specialist Family Physician, Business Leader, HealthCare Entrepreneur, Social Commentator; Soccer&Rugby fan, Rural Boy @ Heart; Passion 4 Making +ve difference",1615,770,548,19,"Johannesburg, South Africa",Fundile Nyati,fundilen,3418,,http://www.phs-world.co.za,false
"-73.8309,40.7",Mon Jul 13 05:43:46 +0000 2020,,,https://www.instagram.com/p/CCkiMYggTfS/?igshid=ohi65th9tnft,0,1282551271573118977,,,,en,"Queens, NY",false,0,,,"<a href=""http://instagram.com"" rel=""nofollow"">Instagram</a>","COVID-19 update 
⚠️My manager sometimes makes fun of me and the security or lost prevention⚠️
Got twitch or tick from growing up in the Detroit public school system and a New York department of homeless services… https://t.co/7lAqmI6CvO",https://twitter.com/johnnybebad666_/status/1282551271573118977,Mon Sep 09 05:59:59 +0000 2019,johnnybebad666_,false,🔨 support81 ⸸⛧Satanist 🦇goth goal oriented bassist?🎸metal💀 extra acting threesome group s&m sex women only call or text 3475843316 cashier Gristedes 59 ♌,2658,42,373,0,"Queens, NY",John Fitzgerald Kennedy Page®,johnnybebad666_,10950,,https://www.suicidegirls.com/join/?aid=1032495,false
"85.84245446,20.29571348",Mon Jul 13 05:40:53 +0000 2020,,,https://www.instagram.com/p/CCkiUygpM7A/?igshid=9mkh6rg79ump,0,1282550547841785857,,,,en,"Bhubaneshwar, India",false,0,,,"<a href=""http://instagram.com"" rel=""nofollow"">Instagram</a>","TOUGH TIMES NEVER LAST, TOUGH PEOPLE DO...

This COVID-19 situation has affected almost all our lives... But we will fight this out too like other calamities of previous times.

Let's unlearn certain ideologies and… https://t.co/XtE1WU6Gkg",https://twitter.com/MasterdoctorIn/status/1282550547841785857,Wed Mar 14 12:11:24 +0000 2018,MasterdoctorIn,false,"Masterdoctor Wellness is running Odisha's best and largest chain of Diabetes Multispeciality clinics .

https://t.co/Q7A5xVn96d
Quality . Economy . Doorstep",101,65,67,0,"Orissa, India",Masterdoctor Wellness ( Dr B Jagadish),MasterdoctorIn,573,,http://www.masterdoctor.in,false
"-0.1890134,51.51193257",Mon Jul 13 06:18:00 +0000 2020,COVID19 outbreak virus WuhanCoronavirus WuhanPneumonia Wuhan China,,https://www.instagram.com/p/CCkmkhgAIvx3z1veNMsNBcC_SEo8aVZ_fIMa180/?igshid=d6ff92gfs7my,0,1282559888858775552,,,,en,"Paddington, London",false,0,,,"<a href=""http://instagram.com"" rel=""nofollow"">Instagram</a>","[13 July 2020 😱] risk during #COVID19

😷🦠 there has been an #outbreak of #virus/#WuhanCoronavirus/#WuhanPneumonia from #Wuhan/#China to the entire human race, causing widespread worries… https://t.co/YSVzf5u3Jt",https://twitter.com/dominicsg/status/1282559888858775552,Sat Jul 04 00:12:39 +0000 2009,dominicsg,false,God save Her Britannic Majesty the Queen 🇬🇧,33,160,144,53,"Paddington, London",Dominic Watanabe,dominicsg,19057,,,false
"1.7042813,52.5861414",Mon Jul 13 06:19:31 +0000 2020,lockdown gardenparty festoonlights props samracevenuedecoration venuedresser venuedecoration,,https://www.instagram.com/p/CCkl8psj5DW/?igshid=n8e45v00rccw,1,1282560268879486977,,,,en,"Great Yarmouth, England",false,0,,,"<a href=""http://instagram.com"" rel=""nofollow"">Instagram</a>","Lockdown garden parties 😁 This one with 85m of festoon lighting, chair hire, backdrops, props and uplighting 😁 #lockdown #gardenparty #festoonlights #props #samracevenuedecoration #venuedresser #venuedecoration… https://t.co/s3uHazS9kQ",https://twitter.com/samantharace7/status/1282560268879486977,Thu Apr 21 13:04:11 +0000 2016,samantharace7,false,"Preferred lantern and Lighting installer at Sam Race - Venue Decoration, Aerial Venue Stylist, Balloon decorator and wedding specialist. #keepsmiling",367,96,114,1,"Gorleston, England ",Sam Race Venue Decoration,samantharace7,534,,http://www.samrace.co.uk,false
"-96.81525669,46.83047485",Mon Jul 13 05:50:38 +0000 2020,,,,0,1282552998644846593,Henriekeg,1282003219460378600,40250265,en,"Fargo, ND",,0,,,"<a href=""http://tapbots.com/tweetbot"" rel=""nofollow"">Tweetbot for iΟS</a>",@Henriekeg It is bad here too. I have trouble finding calm times to get groceries because no one where I live wears masks. All the restaurants are open now but I won’t go near them. I won’t even go to our small zoo because everyone here has decided Coronavirus is over or never existed.,https://twitter.com/paleocyborg/status/1282552998644846593,Wed Jun 10 16:36:28 +0000 2015,paleocyborg,false,"Storm Chaser, Photographer, Adventurer, Artist, Amateur Paleontologist, Bird Lord",154,15,19,0,"Fargo, ND",JW,paleocyborg,489,,http://www.dragonsden.biz/creature-art,false
"103.79128851,1.30386964",Mon Jul 13 06:06:25 +0000 2020,,,https://www.instagram.com/p/CCklPxZHUDT/?igshid=e0wm5yo1u0em,0,1282556970910851072,,,,en,"Central Region, Singapore",false,0,,,"<a href=""http://instagram.com"" rel=""nofollow"">Instagram</a>",The studio was buzzing on Sunday as we held many classes. All the classes were appropriately small sized to ensure there was appropriate social distancing. We are so happy to see you all! Have a great week ahead!… https://t.co/9pb8OuSqF5,https://twitter.com/PalateSingapore/status/1282556970910851072,Tue Mar 24 14:54:47 +0000 2009,PalateSingapore,false,Join us for an unforgettable experience at Palate Sensations.. Engage your tastebuds!,2,138,2,4,Singapore,Palate Sensations,PalateSingapore,7211,,http://www.palatesensations.com,false
"-121.490074,38.568638",Mon Jul 13 06:26:38 +0000 2020,,,https://www.instagram.com/p/CCknjqyAxwQ/?igshid=1scpnb35dd8p2,55,1282562060895879169,,,,en,"Sacramento, CA",false,17,,,"<a href=""http://instagram.com"" rel=""nofollow"">Instagram</a>","Governor Newsom finally announced the release of 8,000 more incarcerated people from CDCR statewide lock ups. WELCOME HOME-FREE THEM ALL! ‼ This is not enough, and not quickly enough, as the pandemic outbreak began… https://t.co/izwcY0f5TT",https://twitter.com/YouthJusticeLA/status/1282562060895879169,Mon Mar 26 21:14:26 +0000 2012,YouthJusticeLA,false,"The Youth Justice Coalition works to build an abolitionist, youth-led movement to end police terror, mass incarceration & criminalization of youth of color.",20524,18351,4821,242,7625 S. Central Ave L.A. 90001,Youth Justice Coalition,YouthJusticeLA,25765,,http://linktr.ee/youthjusticela,false
"-122.419,37.7793",Mon Jul 13 05:10:03 +0000 2020,,,https://www.instagram.com/p/CCkey4Wp-Uw/?igshid=1q2jg5vkmm7tq,0,1282542786097618944,,,,en,"San Francisco, CA",false,0,,,"<a href=""http://instagram.com"" rel=""nofollow"">Instagram</a>","Van Gogh, during COVID Season @ San Francisco, California https://t.co/R7KjFxUezF",https://twitter.com/RichioGalvez/status/1282542786097618944,Tue Feb 11 23:43:12 +0000 2014,RichioGalvez,false,Painter of life,0,3,2,0,"San Francisco, CA",Richio Galvez,RichioGalvez,35,,http://Richiogalvez.com,false
"27.8635755,-32.9911514",Mon Jul 13 04:49:11 +0000 2020,,,https://www.instagram.com/p/CCkcaIQnUwZ/?igshid=1ngl320lhc919,0,1282537537311997954,,,,en,"East London, South Africa",false,0,,,"<a href=""http://instagram.com"" rel=""nofollow"">Instagram</a>","🚘 Nates Car Sales 🚘

Coronavirus Updates And Information ⚠️😷⚠️😷⚠️

 *276 242* Confirmed Cases In South Africa, As Of 12th July
 😱😷😱😷😱

*50 300* Confirmed Cases In EC

We Can Fight This Together 🙏❤️😷

Stay Home… https://t.co/N7EwOuFLUM",https://twitter.com/NatesCarSales/status/1282537537311997954,Mon Mar 02 09:35:50 +0000 2015,NatesCarSales,false,"Over 200 Vehicles to choose from! 🚗🏎 FROM Cheapies, Taxi's, Quantums, LWB Bakkies, Sport Vehicles, Family Vehicles, Double Cabs and More.",10,135,515,0,East London - Amalinda,Nates Car Sales,NatesCarSales,2231,,http://www.natescarsales.co.za,false
"27.83404037,-25.47590445",Mon Jul 13 05:55:21 +0000 2020,,,https://www.instagram.com/p/CCkj-dCD7d8/?igshid=1q8062f2wqr6c,0,1282554185116868608,,,,en,"Lethlabile, South Africa",false,0,,,"<a href=""http://instagram.com"" rel=""nofollow"">Instagram</a>","4. Following the address by the President and consultations with the Ministers responsible for the COVID interventions and the National Command Council (NCC), the Minister of COGTA, @DlaminiZuma  has gazetted… https://t.co/7ji0Hzhyh4",https://twitter.com/billysigudla/status/1282554185116868608,Tue Oct 18 15:50:34 +0000 2011,billysigudla,false,"#Athlete
Never underestimate the power of your word and the power of your will. Willing something to happen 🅱 https://t.co/bteqO4u85V",83882,3279,5001,71,"Germiston, South Africa",Billy Sigudla,billysigudla,117470,,http://siphiwebillysigudla.com,false
"124.647,8.48222",Mon Jul 13 04:45:39 +0000 2020,,,https://www.instagram.com/p/CCkcAGnpVAg/?igshid=9dil84eh7eb0,0,1282536645472944128,,,,en,"Cagayan De Oro City, Northern Mindanao",false,0,,,"<a href=""http://instagram.com"" rel=""nofollow"">Instagram</a>","With the influx of locally stranded individuals (LSIs) and returning overseas Filipinos (ROFs) in Northern Mindanao at the height of the coronavirus disease 2019 (COVID-19) pandemic, the Philippine Port Authority… https://t.co/FISwugXah8",https://twitter.com/PIA_NorMin/status/1282536645472944128,Thu Jan 10 04:54:03 +0000 2013,PIA_NorMin,false,Official twitter of PIA Northern Mindanao. Like us on Facebook Philippine Information Agency 10,70,2178,375,54,Cagayan de Oro City,PIA NorthernMindanao,PIA_NorMin,14589,,http://pianormin.wordpress.com/,false
"-81.09,31.97",Mon Jul 13 04:42:45 +0000 2020,COVID19 coronavirus DoctorBonzo,,https://www.instagram.com/p/CCkbedyADbQ/?igshid=13nocuvgqrxso,0,1282535917778067456,,,,en,"Montgomery, GA",false,0,,,"<a href=""http://instagram.com"" rel=""nofollow"">Instagram</a>","Weekly #COVID19 Update from Georgia

#coronavirus #DoctorBonzo @ Chatham County, Georgia https://t.co/gldWc6jX7E",https://twitter.com/DoctorBonzo/status/1282535917778067456,Fri Nov 25 01:57:45 +0000 2011,DoctorBonzo,false,"Professor/Chair, Community Med | Associate Dean, Diversity/Inclusion | Family Doc #FQHC | #MorehouseMan He/Him ✝️ | Tweets do not reflect opinions of @mercersom",12870,840,258,19,"Savannah, GA","Doctor Bonzo, MD MPH",DoctorBonzo,7774,,https://news.mercer.edu/dr-bonzo-reddick-appointed-chair-of-community-medicine/,false
"-2.75029636,51.18179612",Mon Jul 13 06:11:14 +0000 2020,thesheppey godney craftbeer cider glastonbury realale,,https://www.instagram.com/p/CCkly_WFOLh/?igshid=1sbbihans64on,1,1282558185707102208,,,,en,"Lower Godney, England",false,0,,,"<a href=""http://instagram.com"" rel=""nofollow"">Instagram</a>",Some recent instagrams .. open as normal Wednesday to Sunday. Also takeaway till 7pm. Normal social distancing precautions apply x #thesheppey #godney  naturalwine #craftbeer #cider #glastonbury #realale… https://t.co/PrS0noYmhu,https://twitter.com/thesheppey/status/1282558185707102208,Tue Dec 14 19:09:44 +0000 2010,thesheppey,false,"pub, rooms and kitchen next to the river, beer cider and bakery, art and design. 01458831594 https://t.co/erY6Zfo7oS",2443,2123,1162,45,"glastonbury, somerset",the sheppey,thesheppey,2790,,http://thesheppey.co.uk,false
"-2.2463,53.4793",Mon Jul 13 04:46:50 +0000 2020,biceps GVT training exploring new newwaystoworkout homeworkout lockdown lockdownlife,,https://www.instagram.com/p/CCkcIs9l9zX/?igshid=oltg7u24ni0z,0,1282536943608356865,,,,en,"Manchester, England",false,0,,,"<a href=""http://instagram.com"" rel=""nofollow"">Instagram</a>",Who doesn’t love a bit of exploration into GVT on a Sunday morning especially when your wearing @sinnersattire 💪🏻 #biceps  #GVT #training #exploring #new #newwaystoworkout #homeworkout #lockdown #lockdownlife… https://t.co/Yngs1iTmSH,https://twitter.com/Matt_Attridge/status/1282536943608356865,Tue Jun 14 07:00:05 +0000 2011,Matt_Attridge,false,"Sports Science grad living in Manchester. Tweeting mostly about fitness 💪🏻, food 🍽 and life. 🤳🏻  Carpe Diem! 🍾",11076,893,4942,100,Manchester,Matthew Attridge,Matt_Attridge,24663,,http://www.facebook.com/mattattridge90,false
"32.5811,0.3136",Mon Jul 13 06:14:15 +0000 2020,DJ_MARS_HD,,https://www.instagram.com/p/CCkmCRUnzmp/?igshid=g3tue5tcq1gp,1,1282558942590177286,,,,en,"Kampala, Uganda",false,0,,,"<a href=""http://instagram.com"" rel=""nofollow"">Instagram</a>","DJ Mars vol.3 lockdown Edition
I'm your main Deejay MARS HD
We are GLOBAL DJs
Follow #DJ_MARS_HD @ Kampala, Uganda https://t.co/BTkYmw6HZz",https://twitter.com/DjMarsHD/status/1282558942590177286,Thu Oct 24 16:34:05 +0000 2019,DjMarsHD,false,I'm your main Deejay,374,211,785,1,"Kampala, Uganda",Dj Mars HD,DjMarsHD,174,,,false
"27.83404037,-25.47590445",Mon Jul 13 05:54:16 +0000 2020,,,https://www.instagram.com/p/CCkj2sEDNYA/?igshid=yncitmcguyee,0,1282553915842723841,,,,en,"Lethlabile, South Africa",false,0,,,"<a href=""http://instagram.com"" rel=""nofollow"">Instagram</a>","Following the address by the President and consultations with the Ministers responsible for the COVID interventions and the National Command Council (NCC), the Minister of COGTA, @DlaminiZuma  has gazetted further… https://t.co/Hohf32Kbw2",https://twitter.com/billysigudla/status/1282553915842723841,Tue Oct 18 15:50:34 +0000 2011,billysigudla,false,"#Athlete
Never underestimate the power of your word and the power of your will. Willing something to happen 🅱 https://t.co/bteqO4u85V",83882,3279,5001,71,"Germiston, South Africa",Billy Sigudla,billysigudla,117470,,http://siphiwebillysigudla.com,false
"27.83404037,-25.47590445",Mon Jul 13 05:03:44 +0000 2020,ctmarathon2020 ctmarsthonvirtualrace capetown Covid19,,https://www.instagram.com/p/CCkeEhED6am/?igshid=5fajhrzbsmf5,2,1282541196808802304,,,,en,"Lethlabile, South Africa",false,0,,,"<a href=""http://instagram.com"" rel=""nofollow"">Instagram</a>",I cant wait its less than 100 days to @ctmarathon #ctmarathon2020 #ctmarsthonvirtualrace going to #capetown during  #Covid19 via the virtual app wow I am excited and looking forward for the unique new experience @… https://t.co/41ayBY8qqw,https://twitter.com/billysigudla/status/1282541196808802304,Tue Oct 18 15:50:34 +0000 2011,billysigudla,false,"#Athlete
Never underestimate the power of your word and the power of your will. Willing something to happen 🅱 https://t.co/bteqO4u85V",83882,3279,5001,71,"Germiston, South Africa",Billy Sigudla,billysigudla,117470,,http://siphiwebillysigudla.com,false
"-80.4585509,25.670064",Mon Jul 13 04:28:36 +0000 2020,,,https://twitter.com/FinancialTimes/status/1282525884688130048,0,1282532353735307264,,,,en,"The Hammocks, FL",false,0,,,"<a href=""http://ubersocial.com"" rel=""nofollow"">UberSocial for Android</a>","I'd said that wasn't ""doing nothing"" https://t.co/WgXROSOKtw",https://twitter.com/Heinard/status/1282532353735307264,Sat Feb 13 21:52:04 +0000 2010,Heinard,false,There's but one rule: hunt or be hunted.,103,386,265,7,"Miami, FL.",HT.,Heinard,22801,,,false
"145.10161076,-38.02970759",Mon Jul 13 06:05:47 +0000 2020,isoperiod exercise workingfromhome socialsistancing thenewnorm stage3restrictions vitaminD beachwalk sunshine,,https://www.instagram.com/p/CCkk_uoF8SekvLODCHfSP7kFnYnCgMmeEMKSj80/?igshid=16m8jqcg1pryn,0,1282556813523771400,,,,en,"Melbourne, Victoria",false,0,,,"<a href=""http://instagram.com"" rel=""nofollow"">Instagram</a>","#isoperiod #exercise #workingfromhome #socialsistancing #thenewnorm #stage3restrictions
WE ARE MOT IN LOCKDOWN!
Only SHUTDOWN so get put and get some #vitaminD #beachwalk #sunshine… https://t.co/TnZBnbNElX",https://twitter.com/KkRockChic/status/1282556813523771400,Wed Apr 09 01:38:58 +0000 2014,KkRockChic,false,Host of Wednesdays with Roula show at Radio Rythmos. (fb) THE KK FACTOR Show Ch44 & Foxtel Aurora 183.(fb)Roula krikellis & ContbgWriter of VANIILA MAGAZINE,3868,164,155,6,"Victoria, Australia",Roula Krikellis,KkRockChic,5212,,,false
"27.83404037,-25.47590445",Mon Jul 13 05:53:05 +0000 2020,,,https://www.instagram.com/p/CCkjuDfDbAJ/?igshid=10m2tjdvex7bt,0,1282553617740963840,,,,en,"Lethlabile, South Africa",false,0,,,"<a href=""http://instagram.com"" rel=""nofollow"">Instagram</a>","2.Following the address by the President and consultations with the Ministers responsible for the COVID interventions and the National Command Council (NCC), the Minister of COGTA, @DlaminiZuma  has gazetted further… https://t.co/8XCLTmpZlb",https://twitter.com/billysigudla/status/1282553617740963840,Tue Oct 18 15:50:34 +0000 2011,billysigudla,false,"#Athlete
Never underestimate the power of your word and the power of your will. Willing something to happen 🅱 https://t.co/bteqO4u85V",83882,3279,5001,71,"Germiston, South Africa",Billy Sigudla,billysigudla,117470,,http://siphiwebillysigudla.com,false
"-114.76934856,36.49815666",Mon Jul 13 05:18:14 +0000 2020,,,https://www.instagram.com/p/CCke5kUFedf/?igshid=3ztojb74t0hs,0,1282544845228314624,,,,en,"Nevada, USA",false,0,,,"<a href=""http://instagram.com"" rel=""nofollow"">Instagram</a>","Peace out, California! I got me some Missy Elliot, cookies, and koalas. I am so excited for this next stage of life! 

Also as far as traveling during pandemic, so far best place for mask wearing and precautions was… https://t.co/uiLs35xhb7",https://twitter.com/marloDeWawa/status/1282544845228314624,Tue Nov 19 12:29:30 +0000 2013,marloDeWawa,false,Artist in sound/film/visual distraction. critical cultural studies/analysis. activist academic feminist educator #marloeggplant #ladyzinnoyz,8054,1002,890,15,"Los Angeles, CA",Marlo de Lara - BLM,marloDeWawa,3524,,http://marlodelara.info,false
"-98.65400519,29.5382282",Mon Jul 13 04:49:51 +0000 2020,covid19,,https://www.instagram.com/p/CCkce5VDctT9xh9CcHDERfESmI23AJcDNAZsDk0/?igshid=14myzhzgtttu3,0,1282537704350261248,,,,en,"San Antonio, TX",false,0,,,"<a href=""http://instagram.com"" rel=""nofollow"">Instagram</a>",Just saying lol 😂 #covid19 @ Villa of the El Jefe https://t.co/GcyizZ8Ck7,https://twitter.com/jra011464/status/1282537704350261248,Thu Mar 05 18:02:02 +0000 2009,jra011464,false,just hanging out...looking to enjoy life and have a good time!!!,7840,601,1654,22,"San Antonio, TX",Jeff Allen,jra011464,20622,,,false
"-89.2115,13.6918",Mon Jul 13 05:46:10 +0000 2020,streetphotography road motorcycle day quarantine quarantinelife vintage retro retroaesthetic aesthetic photography elsalvador driving,,https://www.instagram.com/p/CCki7a5jnFM/?igshid=1citj3m475dbi,1,1282551876198838274,,,,en,"Aguilares, El Salvador",false,4,,,"<a href=""http://instagram.com"" rel=""nofollow"">Instagram</a>","I refuse to call this a ""new normal"" 🌲😒.
. 
.
#streetphotography #road #motorcycle #day #quarantine #quarantinelife #vintage #retro #retroaesthetic #aesthetic #photography #elsalvador #driving @ San Salvador https://t.co/t0Vxq2osL6",https://twitter.com/scarabarca/status/1282551876198838274,Wed Aug 31 06:56:44 +0000 2011,scarabarca,false,Photographer & Content Creator | cotizaciones & Eventos al +503 7127 0721,76,91,113,9,"San Salvador, El Salvador",Howl Abarca ✨🌙,scarabarca,3042,,https://oscarabarca.myportfolio.com,false
"-118.3136344,34.09073173",Mon Jul 13 06:22:26 +0000 2020,,,https://www.instagram.com/p/CCknE5ZpgUW/?igshid=v522vno83bh2,0,1282561000655355904,,,,en,"Los Angeles, CA",false,0,,,"<a href=""http://instagram.com"" rel=""nofollow"">Instagram</a>",She's my best friend and my partner in crime for a year. I dont care how many times we had fallouts we are gonna rip it up during the pandemic. Here we are at Cass Vega today living Mexican. Tomorrow we hit Newport… https://t.co/XUL5mbFyX9,https://twitter.com/Jackbenza/status/1282561000655355904,Sat Jul 25 08:39:48 +0000 2009,Jackbenza,false,,2,51,69,0,Hollywood,Jack Benza,Jackbenza,291,,http://jackbenza.com,false
"73.8567,18.5203",Mon Jul 13 06:31:03 +0000 2020,sidehustle parttime vision extraincome additionalsourceofincome income inspireyogesh incomestreams,,https://www.instagram.com/p/CCkoEPXH6Rf/?igshid=1dqdb7anqtj0a,1,1282563171325288449,,,,en,"Pune, India",false,0,,,"<a href=""http://instagram.com"" rel=""nofollow"">Instagram</a>","JOB ~ Just Obey Boss
WORK. OR. NETWORK
Network WORK'S , Work from home business opportunity. #sidehustle 
#parttime #vision #extraincome #additionalsourceofincome #income #inspireyogesh #incomestreams @ Pune,… https://t.co/s6eYpG9lUr",https://twitter.com/inspire_yogesh/status/1282563171325288449,Mon Dec 23 09:59:16 +0000 2013,inspire_yogesh,false,"Entrepreneur, inspiring Speaker, YouTuber, Believe in adding value to people's lives. #inspireyogesh",25,10,60,0,"Pune, India",YOGESH SHAH,inspire_yogesh,69,,,false
"-122.3308,47.6046",Mon Jul 13 05:33:30 +0000 2020,Seattle StreetArt model fashion city,,https://www.instagram.com/p/CCkhei0JfL9/?igshid=xa1gj5ncferg,1,1282548688385183746,,,,en,"Seattle, WA",false,0,,,"<a href=""http://instagram.com"" rel=""nofollow"">Instagram</a>","6/12 Exactly one month ago today, I went exploring my birth town #Seattle alone on a distanced covid adventure and found such beautiful #StreetArt,  it quickly became a selfie party. #model #fashion #city… https://t.co/79LjxknTng",https://twitter.com/richardogawa/status/1282548688385183746,Mon Apr 13 04:20:58 +0000 2009,richardogawa,false,I like words. Some combinations are better than others. Some can perform miracles like getting pizza to show up to your door. Imma daddy who looks like a mommy.,490,271,313,18,"Venice Beach, Los Angeles",Hirofumi Richard TTJ Ogawa,richardogawa,2642,,http://www.richardogawa.com,false
