coordinates,created_at,hashtags,media,urls,favorite_count,id,in_reply_to_screen_name,in_reply_to_status_id,in_reply_to_user_id,lang,place,possibly_sensitive,retweet_count,reweet_id,retweet_screen_name,source,text,tweet_url,user_created_at,user_screen_name,user_default_profile_image,user_description,user_favourites_count,user_followers_count,user_friends_count,user_listed_count,user_location,user_name,user_screen_name,user_statuses_count,user_time_zone,user_urls,user_verified
"-114.05160821,51.05205267",Mon Jul 13 20:49:32 +0000 2020,,,https://www.instagram.com/p/CCmKT8hJceS/?igshid=14owmm91hh3fv,0,1282779217357230080,,,,en,"Calgary, Alberta",false,0,,,"<a href=""http://instagram.com"" rel=""nofollow"">Instagram</a>","Recently we have noticed a rise in people putting off their renovations until they know what is happening with Covid-19 Virus, but you might want to get your new kitchen before the tax hike gets here...  If you have… https://t.co/RIBgnITH9h",https://twitter.com/EkkoCabinetry/status/1282779217357230080,Sat Apr 18 15:33:36 +0000 2009,EkkoCabinetry,false,"Awaken to a space tailored to reflect your lifestyle.
Kitchens designs start with inspiration. 
Our showroom is the perfect place to view beautiful cabinetry.",649,333,684,10,"Calgary, Alberta",Ekko Cabinetry Ltd.,EkkoCabinetry,312,,http://www.Ekkocabinetry.com,false
"-0.1094,51.5141",Mon Jul 13 20:52:57 +0000 2020,ad,,https://www.instagram.com/p/CCmKU3_ladv/?igshid=a7yigffgj0ki,0,1282780074773811201,,,,en,"City of London, London",false,0,,,"<a href=""http://instagram.com"" rel=""nofollow"">Instagram</a>","#ad | during lockdown, I made a promise to myself to be more active in my every day, so I've been going on daily walks, sometimes even runs, doing workouts and really pushing myself (shocker, I know) but I feel so… https://t.co/mV45ppGttj",https://twitter.com/gxsia/status/1282780074773811201,Sat Oct 10 13:50:13 +0000 2009,gxsia,false,polish gal ☆ london,22936,3385,120,19,london,gosia joanna,gxsia,57944,,http://Instagram.com/gxsia,false
"-84.3889,33.7566",Mon Jul 13 21:33:12 +0000 2020,Covid19 ATLStrong Streetz945atl atlanta,,https://www.instagram.com/p/CCmAIWghyh6/?igshid=1lstb1kb3xgak,0,1282790206345580544,,,,en,"Atlanta, GA",false,0,,,"<a href=""http://instagram.com"" rel=""nofollow"">Instagram</a>","Need to know where to get testing for #Covid19 ? Swipe for a list of locations available today‼️ 

Courtesy of: cityofatlantaga #ATLStrong #Streetz945atl #atlanta @ Atlanta, Georgia https://t.co/dmWcoGUM7r",https://twitter.com/streetz945atl/status/1282790206345580544,Fri Jun 22 17:03:57 +0000 2012,streetz945atl,false,The OFFICIAL TWITTER for Streetz 94.5 Atlanta | Atlanta's Number 1 Station in the STREETZ |#streetz945atl #streetz945 IG @streetz945atl,416,38930,1215,177,"Atlanta, GA",Streetz 94.5 ATL,streetz945atl,118228,,http://www.streetz945atl.com,false
"-118.2445,34.0564",Mon Jul 13 21:20:49 +0000 2020,California Covid19,,https://www.instagram.com/p/CCmN5CUDRhF/?igshid=1fwy3byksu88,0,1282787089562710016,,,,en,"Los Angeles, CA",false,0,,,"<a href=""http://instagram.com"" rel=""nofollow"">Instagram</a>","#California
#Covid19
✳😷✳ @ Los Angeles, California https://t.co/3x0QA1CzjE",https://twitter.com/digitalbrain555/status/1282787089562710016,Sat Mar 12 20:19:49 +0000 2011,digitalbrain555,false,"🎼Singer/Songwriter/Guitarist/Composer for 33 & 🔮SorcererOfSounds. Streetnote Records. Life is a film, you write your script of your own domain. - RC",12132,1698,4137,45,"Los Angeles,Ca.",Roger Crews,digitalbrain555,6458,,,false
"-104.86752203,39.58612936",Mon Jul 13 19:59:50 +0000 2020,,,https://www.instagram.com/p/CCmEn3TBrOH/?igshid=ih2m7vjfihcc,0,1282766706235113477,,,,en,"Centennial, CO",false,0,,,"<a href=""http://instagram.com"" rel=""nofollow"">Instagram</a>",We are still helping businesses get found online especially now that because of COVID19. If your site has been a sales brochure its your to evolve into a findable thought leader. We virtual team trainings to make you… https://t.co/3lCZ5hnGDz,https://twitter.com/HeatherLutze/status/1282766706235113477,Mon Nov 24 02:56:43 +0000 2008,HeatherLutze,false,"Heather Lutze, Master Trainer & Owner of  Findability University. Offering No-Geek Speak, #SEO-#Findability #Training for individuals, #BusinessOwners & corps.🤓",1021,6066,6085,495,"Denver, Colorado","Heather Lutze, CSP",HeatherLutze,10193,,http://www.Findability.com,false
"-84.3197,46.5215",Mon Jul 13 20:41:51 +0000 2020,,,https://www.instagram.com/p/CCmJbryBF7l/?igshid=ykqam7lzl6k7,0,1282777282919059456,,,,en,"Sault Ste. Marie, Ontario",true,0,,,"<a href=""http://instagram.com"" rel=""nofollow"">Instagram</a>","*** UPDATE ***

1 SPOT just opened up in CAMP #2: JULY 20-24, 2020!

SAULT STE. MARIE - SUMMER DAY CAMPS!

Algoma Public Health has recently green-lit our Summer Camps in JULY. We will be following all Covid-19… https://t.co/61uiYFf7T7",https://twitter.com/StudioDanceArts/status/1282777282919059456,Sat Aug 29 13:05:08 +0000 2009,StudioDanceArts,false,"Excellence in dance education throughout northern Ontario & Michigan. Locations in Sault Ste. Marie, Elliot Lake & Marquette. Come dance with us!",42,700,1168,16,Canada & USA,Studio Dance Arts,StudioDanceArts,1604,,http://www.studiodancearts.com,false
"-121.1784,38.6763",Mon Jul 13 20:11:19 +0000 2020,notagain covid19 groundhogday fuck2020,,https://www.instagram.com/p/CCmF75WJO61/?igshid=1xp6s21qns7dh,0,1282769596085305345,,,,en,"Folsom, CA",false,0,,,"<a href=""http://instagram.com"" rel=""nofollow"">Instagram</a>","Goddammit #notagain #covid19 #groundhogday #fuck2020 @ Folsom, California https://t.co/LtIjiiLLNg",https://twitter.com/nbabbitz/status/1282769596085305345,Wed Aug 27 06:37:41 +0000 2008,nbabbitz,false,#teamxnd member. NASM certified Personal Trainer. Precision Nutrition certified. Crossfit athlete who is constantly working to be better.,758,38,311,0,"Citrus Heights, CA",nbabbitz,nbabbitz,1146,,http://shop.teamxnd.com/nbabbitz/Home,false
"-119.7839,36.7398",Mon Jul 13 20:03:20 +0000 2020,crisis america americanflag blm coronavirus covid19 covid_19 usa usa upsidedown icantbreathe justiceforgeorgefloyd justice shelterinplace reopening justiceforahmaud,,https://www.instagram.com/p/CCmFBdhg6d7/?igshid=554zcdxltp8y,0,1282767589614198784,,,,en,"Fresno, CA",false,0,,,"<a href=""http://instagram.com"" rel=""nofollow"">Instagram</a>","Shelter in Place (Day 118).
#crisis #america #americanflag #blm #coronavirus #covid19 #covid_19 #usa #usa🇺🇸 #upsidedown #icantbreathe #justiceforgeorgefloyd #justice #shelterinplace #reopening #justiceforahmaud… https://t.co/Its6zoFm6C",https://twitter.com/JesseQuevedo/status/1282767589614198784,Thu Aug 05 18:18:56 +0000 2010,JesseQuevedo,false,Just a guy who gets a little bored sometimes.,150,61,678,0,"Santa Cruz, CA",JQuevedoPhotography,JesseQuevedo,1753,,,false
"153.3921,-28.0183",Mon Jul 13 21:43:46 +0000 2020,,,https://www.instagram.com/p/CCmQhGUJEOq/?igshid=1068tulwpszbg,1,1282792865467256832,,,,en,"Gold Coast, Queensland",false,0,,,"<a href=""http://instagram.com"" rel=""nofollow"">Instagram</a>","Today's Gold Coast Bulletin front page: SHOOT FOR STARS - The Gold Coast is being pitched to Disney as the new home for Star Wars on the back of low COVID cases making us ""the safest place on Earth. @gcbulletin… https://t.co/vDyQGzzg7F",https://twitter.com/GCS_Pottsy/status/1282792865467256832,Mon Nov 22 04:58:02 +0000 2010,GCS_Pottsy,false,"Gold Coast Bulletin Assistant Chief of Staff. Also writes about politics, buildings and history 
https://t.co/5eoFDV6WcK",25289,2213,1826,68,Gold Coast,Andrew Potts,GCS_Pottsy,13980,,http://www.goldcoastbulletin.com.au,true
"-122.675,45.5236111",Mon Jul 13 21:41:32 +0000 2020,Coronavirus COVID19,,http://bit.ly/29Fgvzr https://bit.ly/3j2uP4I http://bit.ly/29Fgvzr,0,1282792300356096000,,,,en,"Portland, OR",false,0,,,"<a href=""https://dlvrit.com/"" rel=""nofollow"">dlvr.it</a>","https://t.co/S4oWTeAfVB Blog Link | Grocery Workers Are Key During the Virus. and They’re Afraid: For Accurate &amp; Up To Date Information Click {CDC | #Coronavirus (#COVID19)} Every day, grocery workers are… https://t.co/2ocQMDGClG - View This Post | https://t.co/S4oWTeAfVB",https://twitter.com/BlogThisLink/status/1282792300356096000,Sun May 23 18:29:41 +0000 2010,BlogThisLink,false,"#Pics, #Videos, #Shopping",438,2323,1742,26,,Weigle Tech,BlogThisLink,18633,,,false
"34.751145,31.80242167",Mon Jul 13 20:19:53 +0000 2020,,,https://www.instagram.com/p/CCmG6izJro2/?igshid=4wumj972pkwj,0,1282771752267976713,,,,en,Israel,false,0,,,"<a href=""http://instagram.com"" rel=""nofollow"">Instagram</a>","As ultimate_peace is unable to hold its usual summer camp due to COVID, I am sharing images from my time documenting camp in 2019. I hope these images bring smiles, happy tears and warm hearts to campers, families,… https://t.co/XJYFJTKkPz",https://twitter.com/adiffsmithphoto/status/1282771752267976713,Wed Jan 18 01:55:37 +0000 2012,adiffsmithphoto,false,"Photographer, educator, athlete and citizen of the world. Currently based in Atlanta, GA, USA 🍑",153,182,357,4,"Atlanta, GA",Amy Smith,adiffsmithphoto,929,,http://www.adifferentsmith.com,false
"-78.7422867,42.9631386",Mon Jul 13 21:29:01 +0000 2020,,,https://www.instagram.com/p/CCmO06ch--J/?igshid=1jh43k32mul96,0,1282789149892841474,,,,en,"Williamsville, NY",false,0,,,"<a href=""http://instagram.com"" rel=""nofollow"">Instagram</a>","Covid mask breakouts got you feeling 😳😫😷  we have a solution...

 Total Turnaround Bakuchiol + Beta Glucan Retinol Alternative Serum 

Give your skin the rescue that it needs from aging, dullness, environmental… https://t.co/ARtFwZlALK",https://twitter.com/BfloGalOrganics/status/1282789149892841474,Wed Feb 25 13:03:05 +0000 2009,BfloGalOrganics,false,"plant based, organic skincare and beauty.  cruelty free, toxin free and good for you inside and out.",6,920,1349,15,New York Buffalo,Buffalo Gal Organics,BfloGalOrganics,2300,,http://BuffaloGalOrganics.com,false
"-84.4125,33.5726",Mon Jul 13 21:28:07 +0000 2020,socialdistancing stayhappy staysafe stayhealthyandfit,,https://www.instagram.com/p/CCmOuV_BjZt/?igshid=1j1lwk4t5bq1r,0,1282788923522060293,,,,en,"Riverdale, GA",false,0,,,"<a href=""http://instagram.com"" rel=""nofollow"">Instagram</a>","What a joy to have family together some Sundays to have a little fun in the sun at the pool #socialdistancing #stayhappy #staysafe 
#stayhealthyandfit @ Riverdale, Georgia https://t.co/lOhfGD4NzI",https://twitter.com/valenciaseay/status/1282788923522060293,Wed Aug 17 19:28:30 +0000 2011,valenciaseay,false,Georgia State Senator District 34 since 2002 with proven responsible leadership.,726,1811,368,74,"Riverdale, GA",Valencia Seay,valenciaseay,1967,,http://www.seayforsenate.us,false
"-118.23951,34.0614",Mon Jul 13 20:16:10 +0000 2020,,,https://www.instagram.com/p/CCmGffrDQDU/?igshid=4bevzkye617t,0,1282770819756838917,,,,en,"Los Angeles, CA",false,0,,,"<a href=""http://instagram.com"" rel=""nofollow"">Instagram</a>","Please note that since the beginning of the pandemic 😷, Endorffeine has always been OPEN IN CHINATOWN, and ALSO PERSONALLY DELIVERS throughout Los Angeles on Monday + Wednesday 🚚♥️... Visit us in store, or DM us to… https://t.co/IiJf3rjuna",https://twitter.com/endorffeine/status/1282770819756838917,Sun Mar 22 17:54:52 +0000 2009,endorffeine,false,"Former biochemist. Trained chef. Currently brewing coffee & tea at Endorffeine coffee bar in Chinatown, Los Angeles. Tu-Fri 7am-6pm, Sat-Sun 8am-4pm.",648,334,99,15,Los Angeles,endorffeine,endorffeine,4978,,http://endorffeine.coffee,false
"-97.40731832,27.76448476",Mon Jul 13 21:32:30 +0000 2020,,,https://www.instagram.com/p/CCmO4hijxOz/?igshid=1uankh1uhdpo4,1,1282790029090332674,,,,en,"Corpus Christi, TX",false,0,,,"<a href=""http://instagram.com"" rel=""nofollow"">Instagram</a>","Del Mar College employee and student test positive for COVID-19
Del Mar College has received information that one employee and one student have tested positive for COVID-19.  The employee and student were… https://t.co/1n35UEABtg",https://twitter.com/ElCronica/status/1282790029090332674,Sat Apr 25 03:45:40 +0000 2020,ElCronica,false,The Corpus Christi Crónica is dedicated to building and empowering our community through interactive communication and on-demand information.,50,48,425,0,"Corpus Christi, Texas",Corpus Christi Crónica,ElCronica,161,,https://www.corpuschristicronica.com,false
"174.7651,-36.8541",Mon Jul 13 20:31:37 +0000 2020,,,https://www.instagram.com/p/CCmIQpHM0ST/?igshid=mywo6hkh54mp,0,1282774707243290624,,,,en,"Auckland, New Zealand",false,0,,,"<a href=""http://instagram.com"" rel=""nofollow"">Instagram</a>","Here's a bouquet of our favourite herb garnishes 🌿 When we were in lockdown, I bought lots of herb seedlings and plants and hoped that I can keep them alive through the period of isolation. We didn't know how long it… https://t.co/7Z6W9tLEPz",https://twitter.com/petitesweetsnz/status/1282774707243290624,Sat Mar 07 09:00:51 +0000 2015,petitesweetsnz,false,petite sweets - handmade treats. best shared. http://t.co/g3N7OunSeY,75,30,111,1,New Zealand,Petite Sweets NZ,petitesweetsnz,493,,http://facebook.com/petitesweetsnz,false
"9.41666667,47.33333333",Mon Jul 13 19:56:27 +0000 2020,,,https://www.instagram.com/p/CCmEPIMhTRG/?igshid=1gf8ahb4k719z,0,1282765857102471168,,,,en,"Appenzell, Switzerland",true,0,,,"<a href=""http://instagram.com"" rel=""nofollow"">Instagram</a>","Today I saw a ring around the sun that is called, you will not believe it, “corona”.  Good sign or bad sign... @ Appenzell https://t.co/OJngNJGDtk",https://twitter.com/drsbartdeboer/status/1282765857102471168,Sat Feb 14 08:21:39 +0000 2009,drsbartdeboer,false,DreamPort Leisure Consultants | Managing Director | Non Executive Board Member | Imagineer | Speaker | Transmedia Storyteller |,69,7320,300,105,Netherlands,Bart de Boer,drsbartdeboer,3545,,http://about.me/bartdeboer,false
"-82.58047285,27.31485545",Mon Jul 13 20:47:04 +0000 2020,covidvacation2020 socialdistancing,,https://www.instagram.com/p/CCmKBzTjqXsS3LE8NQ-MHggs0s0OLuk_B_jpPM0/?igshid=kecqawt2513k,0,1282778596667387904,,,,en,"Sarasota, FL",false,0,,,"<a href=""http://instagram.com"" rel=""nofollow"">Instagram</a>","Social distancing Day #2. Practically private beach.
#covidvacation2020 #socialdistancing @ Lido Beach,Fla https://t.co/bSYHP3rJgo",https://twitter.com/jdraper76/status/1282778596667387904,Thu Aug 29 12:34:04 +0000 2013,jdraper76,false,,872,36,108,1,,Jason Draper,jdraper76,1217,,,false
"-73.9675,40.7779",Mon Jul 13 21:33:50 +0000 2020,,,https://www.instagram.com/p/CCmPT6fglj5/?igshid=xpadmao51c9c,0,1282790365007761408,,,,en,"Manhattan, NY",false,0,,,"<a href=""http://instagram.com"" rel=""nofollow"">Instagram</a>","Open Not Open, the newest in my on-going weekly series of original pieces to help you dance your way through the pandemic. Once a week, I hand make a spanky new tune (with love) just for you. Bespoke music - it’s all… https://t.co/ht0rycctW6",https://twitter.com/kevinshayes/status/1282790365007761408,Sat Feb 27 02:18:46 +0000 2010,kevinshayes,false,"Award-winning composer, songwriter, lyricist, producer and creator.",4,46,34,0,Los Angeles | New York,Kevin Saunders Hayes,kevinshayes,142,,http://kevinsaundershayes.com,false
"-97.7475,30.2677",Mon Jul 13 21:37:03 +0000 2020,,,https://www.instagram.com/p/CCmPv8hFLpN99cRjsPw0JlMyYK7k2LnoKx3QO40/?igshid=nuluaue59sjr,0,1282791171786444800,,,,en,"Austin, TX",false,0,,,"<a href=""http://instagram.com"" rel=""nofollow"">Instagram</a>","So our friend Cynthia’s rubber duckie is not very good at social distancing (I surprised her)...😄 @ Austin, Texas https://t.co/cLk7ZHUlQC",https://twitter.com/jaybullington/status/1282791171786444800,Wed Jan 25 18:28:47 +0000 2012,jaybullington,false,,269,42,88,4,,Jay Bullington,jaybullington,1237,,,false
"-80.25921464,43.53694496",Mon Jul 13 20:52:22 +0000 2020,,,https://www.instagram.com/p/CCmKopJHneh/?igshid=cy4fy92fc8m8,1,1282779926765211650,,,,en,"Guelph, Ontario",false,0,,,"<a href=""http://instagram.com"" rel=""nofollow"">Instagram</a>",We have recently relocated our office to the Junction in Guelph! We are super excited to make this move in 2020. Let's push through this pandemic and make this our best year yet! @ Beyond Rewards HR Consulting https://t.co/lsl6QcZm9L,https://twitter.com/beyondrewards/status/1282779926765211650,Mon Jan 25 03:20:05 +0000 2010,beyondrewards,false,"Beyond Rewards-an industry leader in Human Resources, Recruitment, Health & Safety, Workplace Investigations & AODA. We are your People Management Partners.",701,1310,1315,155,"Guelph, ON Canada",Beyond Rewards Inc. Human Resource Consulting,beyondrewards,13243,,http://www.beyondrewards.ca,false
"-118.739,34.2711",Mon Jul 13 20:08:19 +0000 2020,home quarantine music alternative photo insta,,https://www.instagram.com/p/CCmFmCxgmt6/?igshid=2v12dnba4m1j,0,1282768843706961927,,,,en,"Simi Valley, CA",false,0,,,"<a href=""http://instagram.com"" rel=""nofollow"">Instagram</a>","Just 7:10 in the living room

#home #quarantine #2020 #music #alternative #photo #insta @ Simi Valley, California https://t.co/tYlZpAsh5N",https://twitter.com/AlexDanteMusic/status/1282768843706961927,Tue May 31 17:12:59 +0000 2016,AlexDanteMusic,false,I play music. Let me play you music.,1118,560,164,1,"Hollywood, Los Angeles",Alex Dante,AlexDanteMusic,318,,http://www.codesilver.net,false
"-1.8310986,53.92796",Mon Jul 13 19:59:44 +0000 2020,ilkley diy local localbusiness socialdistancing beergarden socialdistancingbooths palletproject,,https://www.instagram.com/p/CCmEnMqn8kn/?igshid=34jov5om96yj,0,1282766684831522821,,,,en,"Ilkley, England",false,0,,,"<a href=""http://instagram.com"" rel=""nofollow"">Instagram</a>","🛠 Busy Building! 🛠 

#ilkley #diy #local #localbusiness #socialdistancing #beergarden #socialdistancingbooths #palletproject @ Ilkley Moor Vaults https://t.co/4ZTP2bsHtL",https://twitter.com/vaults_pub/status/1282766684831522821,Fri Jan 06 21:24:44 +0000 2012,vaults_pub,false,"Ilkley pub serving delicious homemade food, cask ale, great parties, functions, weddings & al fresco dining & large beer garden complete with domes!",473,1637,307,22,"Ilkley, West Yorkshire",Ilkley Moor Vaults,vaults_pub,1154,,http://ilkleymoorvaults.co.uk,false
"-73.95,40.65",Mon Jul 13 20:55:21 +0000 2020,,,https://www.instagram.com/p/CCmK-k9A8gA/?igshid=1xerayxjflvuq,1,1282780681203056646,,,,en,"Brooklyn, NY",false,0,,,"<a href=""http://instagram.com"" rel=""nofollow"">Instagram</a>","Thank You so much For featuring our song 
America’s Real Pandemic ! 
🙏🏾🎧🎼💯🎤♎️👊🏽💋 @ Brooklyn, New York https://t.co/YN1R49BQSU",https://twitter.com/Sugahlyrics/status/1282780681203056646,Sat Feb 09 20:58:41 +0000 2013,Sugahlyrics,false,Poetic Floetry -Lyricist - Spoken Wordzzzz-Afro Deep Housemusic -Jazz -Soul -Funk Honeycomb Music...#poeticsoul,210,336,331,0,NEW YORK,Sugah Lyrics,Sugahlyrics,1695,,http://facebook.com/Sugahlyrics,false
"-117.1604737,32.73851241",Mon Jul 13 21:05:44 +0000 2020,mexicanfood sandiego covid19 outdoorliving,,https://www.instagram.com/p/CCmMKgEjSys/?igshid=l6sdauavyjyj,0,1282783290672513029,,,,en,"San Diego, CA",false,0,,,"<a href=""http://instagram.com"" rel=""nofollow"">Instagram</a>","We’ve added more outdoor tables &amp; are looking to add more.  We can safely accommodate you! 
#mexicanfood #sandiego #covid19 #outdoorliving @ Jimmy Carter's Mexican Cafe https://t.co/bfFDfQxFba",https://twitter.com/JimmyCartersMEX/status/1282783290672513029,Thu Nov 29 20:54:06 +0000 2018,JimmyCartersMEX,false,Mexican cafe offers the best Mexican food around. We use the freshest ingredients in all of our authentic Mexican dishes.,18,25,82,2,"San Diego, CA",Jimmy Carter's Mexican Cafe,JimmyCartersMEX,746,,,false
"-84.5596,39.3355",Mon Jul 13 20:14:33 +0000 2020,quarantine hair growth,,https://www.instagram.com/p/CCmGTvhA3uR/?igshid=11lp3k29yx2t4,0,1282770413668364288,,,,en,"Fairfield, OH",false,0,,,"<a href=""http://instagram.com"" rel=""nofollow"">Instagram</a>","Push through #quarantine #hair #growth 🤣 @ Fairfield, Ohio https://t.co/qS94Ux873y",https://twitter.com/Thatgurl_73/status/1282770413668364288,Sun Mar 29 23:20:25 +0000 2009,Thatgurl_73,false,"Accountant who LOVES sports, music, allthingspink, and technology. ufollow, itweet :)",3644,250,650,20,Ohio,Ina ♑,Thatgurl_73,18843,,,false
"-84.384116,35.737276",Mon Jul 13 19:54:32 +0000 2020,,,https://www.instagram.com/p/CCmEBC8Az1v/?igshid=89rdmz7tjtwa,0,1282765372266106880,,,,en,"Tennessee, USA",false,0,,,"<a href=""http://instagram.com"" rel=""nofollow"">Instagram</a>","Went blackberry picking with the Comes family after work today (while social distancing!) and it was a fantastic (and safe) way to break up the ""safe at home"" routine! Can't wait to go back in a few weeks for… https://t.co/ecMheN89DQ",https://twitter.com/kfullzz/status/1282765372266106880,Sat Sep 17 20:55:31 +0000 2011,kfullzz,false,"MS Microbiology - UTK 🔶
Professional science cheese 🧀, crazy cat lady in training 🐈, and Mom friend (also moonlights as a cosplayer)",8832,286,659,4,"Knoxville, TN",Kate Fullerton (she/her),kfullzz,1257,,,false
"-79.7164011,43.7742911",Mon Jul 13 20:47:32 +0000 2020,Covid19 Featured India NEWS airlines,,http://dlvr.it/RbY3CD,0,1282778712769826817,,,,en,"Brampton, Ontario",false,1,,,"<a href=""https://dlvrit.com/"" rel=""nofollow"">dlvr.it</a>",India: International flights to remain suspended till July 31: New Delhi:  The Directorate General of Civil Aviation (DGCA) issued a circular on Friday extending the suspension on scheduled commercial… https://t.co/tY54BlGBGh #Covid19 #Featured #India #NEWS #airlines,https://twitter.com/Weeklyvoice/status/1282778712769826817,Tue Mar 30 17:43:21 +0000 2010,Weeklyvoice,false,The South Asian Community's Trusted Source of News Since 1997,145,381,275,10,Toronto,Weekly Voice,Weeklyvoice,21473,,http://www.Weeklyvoice.com,false
"-74.00187056,40.7332086",Mon Jul 13 21:07:06 +0000 2020,,https://twitter.com/chismetime/status/1282783637520318464/photo/1,http://dlvr.it/RbY5Sg,0,1282783637520318464,,,,en,"Manhattan, NY",false,0,,,"<a href=""https://dlvrit.com/"" rel=""nofollow"">dlvr.it</a>","Mark Anthony Urquiza Obituary Accuses Arizona Officials of Failing: Kristin Urquiza, writing about her father’s death, pointed the finger at how state and federal leaders have handled the coronavirus pandemic. https://t.co/mp1xiJd5bP (vía NYtimes) https://t.co/UjW9gNEg27",https://twitter.com/chismetime/status/1282783637520318464,Mon Nov 23 06:00:07 +0000 2009,chismetime,false,"Spanish & English gossip news / chismes. I love all chismes! (sources: TMZ, PerezHilton, En el Brasero and mx hola! we added +news/noticias (El Universal) xx",1,276,12,5,Your tongue,Chisme Time,chismetime,208114,,https://www.facebook.com/chismetimeone,false
"-74.0064,40.7142",Mon Jul 13 21:07:37 +0000 2020,,,https://www.instagram.com/p/CCmMYS-JO8k/?igshid=186ojrq321c7r,16,1282783768021995521,,,,en,"Manhattan, NY",false,0,,,"<a href=""http://instagram.com"" rel=""nofollow"">Instagram</a>","Chinstrap Monday:) I was social distancing, of course! @ New York, New York https://t.co/6WLaAJkaia",https://twitter.com/DianaRoccoABC7/status/1282783768021995521,Mon May 04 15:13:33 +0000 2009,DianaRoccoABC7,false,"Reporter @abc7ny, Cuse' Alum. Truth seeker. Storyteller. Jersey-born. Totally Gluten Free. Graced. Follow me on IG: @dianaroccoabc7",3496,4742,746,71,"New York, NY",Diana Rocco ABC7,DianaRoccoABC7,2835,,,false
"-73.47935661,45.6677507",Mon Jul 13 21:43:03 +0000 2020,,,http://dlvr.it/RbY9zx,0,1282792681396027392,,,,en,"Varennes, Québec",false,0,,,"<a href=""https://dlvrit.com/"" rel=""nofollow"">dlvr.it</a>",Fighting Stigma : Parents of children born during pandemic to take an additional three weeks of leave: The National Women's Council of Ireland (NWCI) said the increase of paid parent's leave from two to five weeks falls far short of the needs of mothers… https://t.co/1jcktJH3CQ,https://twitter.com/pairsonnalitesN/status/1282792681396027392,Wed Sep 15 15:55:47 +0000 2010,pairsonnalitesN,false,Ireland — Scotland — Inuit —  Svenska  | Keeping up-to-date on global exclusion — Stigmabase is a canadian internet non-profit Initiative,0,1484,1328,108,Ireland | Scotland | Inuit | Skandinavien,Stigmabase | NORDIC,pairsonnalitesN,787710,,https://edu.stigmabase.org/,false
"-73.97585801,40.73958614",Mon Jul 13 21:31:52 +0000 2020,MASKSENDERS,,https://www.instagram.com/p/CCmPJxWoA2f/?igshid=1vkwxiwk6h7qf,0,1282789870373679105,,,,en,"Manhattan, NY",false,0,,,"<a href=""http://instagram.com"" rel=""nofollow"">Instagram</a>",#MASKSENDERS ••• We have donated more masks to the Cancer Center team at Bellevue Hospital in NYC helping save lives 24/7 against cancer and now working even harder to protect their patience agains COVID19! These… https://t.co/Gw4tLXuHLQ,https://twitter.com/DaraSenders/status/1282789870373679105,Sat Apr 04 15:46:23 +0000 2009,DaraSenders,false,lets all glitter together! The Official Twitter Account of Dara SenderS - Shop the collection at https://t.co/7LA5PgzIIw,1502,668,1938,44,"New York, NY",Dara Senders,DaraSenders,8885,,http://www.instagram.com/darasendersofficial,false
