coordinates,created_at,hashtags,media,urls,favorite_count,id,in_reply_to_screen_name,in_reply_to_status_id,in_reply_to_user_id,lang,place,possibly_sensitive,retweet_count,reweet_id,retweet_screen_name,source,text,tweet_url,user_created_at,user_screen_name,user_default_profile_image,user_description,user_favourites_count,user_followers_count,user_friends_count,user_listed_count,user_location,user_name,user_screen_name,user_statuses_count,user_time_zone,user_urls,user_verified
"-118.2445,34.0564",Mon Jul 13 16:39:08 +0000 2020,,,https://www.instagram.com/p/CCltqAvnlR6/?igshid=18r1ui1gv4m1m,1,1282716201194487814,,,,en,"Los Angeles, CA",false,1,,,"<a href=""http://instagram.com"" rel=""nofollow"">Instagram</a>","According to the L.A. Times coronavirus tracker, L.A. county has now recorded more than 133,000 confirmed cases and more than 3,800 deaths. L.A. Mayor Eric Garcetti warned that the city could reimpose a mandatory… https://t.co/nDKyYDnFe9",https://twitter.com/Radio_Bassment/status/1282716201194487814,Thu Apr 01 01:57:44 +0000 2010,Radio_Bassment,false,@real923la (LA) @997now (SF) @977krck (Palm Springs) @jamn1075 (Portland) @wamo100 (Pittsburgh) @wild1055fm (Corpus Christi) Hosted by @DJERock,632,890,233,19,Multi-Market,Radio Bassment,Radio_Bassment,2003,,https://linkin.bio/radio_bassment,false
"85.5240996,27.7233461",Mon Jul 13 16:35:11 +0000 2020,joburg Jozi southAfrica virtualtour lockdown stayhome Nargarkot katmandu valley nepal,,https://www.instagram.com/p/CCltM17n_gw/?igshid=hl7z189azpsa,0,1282715208247640069,,,,en,Nepal,false,1,,,"<a href=""http://instagram.com"" rel=""nofollow"">Instagram</a>",It may be cold in #joburg #Jozi #southAfrica but as I take you on a #virtualtour of the world as we reamain under #lockdown and #stayhome we today visit #Nargarkot in the #katmandu #valley in #nepal.  Nargakot is 32… https://t.co/beAaFWHHTv,https://twitter.com/Howardsackstein/status/1282715208247640069,Wed May 18 23:24:58 +0000 2011,Howardsackstein,false,"King of Social media, Explosive Political Activist, Lover of Life, Meanderer of the Globe, Official Photographer to Life itself",133,1915,1067,37,South Africa & the world,Howard sackstein,Howardsackstein,3688,,,false
"-80.1936,25.7751",Mon Jul 13 16:07:47 +0000 2020,BeResponsible NewYorkHas0NewCases WeHave15k,,https://www.instagram.com/p/CClqEBGJDwn/?igshid=19olwqssblu8k,0,1282708308772691969,,,,en,"Miami, FL",false,0,,,"<a href=""http://instagram.com"" rel=""nofollow"">Instagram</a>","This ain’t no joke! I hear more friends are catching Covid. Stop being reckless my friends mask up 😷 🧤 and stay home. #BeResponsible #NewYorkHas0NewCases #WeHave15k @ Miami, Florida https://t.co/w4FnjQaitz",https://twitter.com/LAZ_vip/status/1282708308772691969,Thu Sep 23 16:45:11 +0000 2010,LAZ_vip,false,C.E.O. #VIPnation RSVP for @CraftSocial @SPACE Personal Injury Advisor @305-NO-FAULT #CarAccident? #iCanHelp 786.975.3467,1228,958,1487,22,"miami, fl",LAZ_VipNation,LAZ_vip,17891,,,false
"-81.95189,28.04568",Mon Jul 13 15:28:08 +0000 2020,,,https://www.instagram.com/p/CCllht7nVau/?igshid=bkxf0r07tb7z,1,1282698331282522115,,,,en,"Lakeland, FL",false,2,,,"<a href=""http://instagram.com"" rel=""nofollow"">Instagram</a>","Amtrak has reduced Lakeland train service, citing revenue declines stemming from the coronavirus. Before the cuts, northbound and southbound trains left the station on Lake Mirror daily. Now there's direct service… https://t.co/Y8WHxS55vj",https://twitter.com/LkldNow/status/1282698331282522115,Wed Nov 19 19:55:41 +0000 2014,LkldNow,false,Mobile news to connect you with Lakeland,923,2586,387,40,,Lkld Now,LkldNow,14286,,http://www.lkldnow.com,false
"-79.31125739,43.66210426",Mon Jul 13 16:08:41 +0000 2020,staysafe stayhealthy,,https://www.instagram.com/p/CClqK1wJTwD/?igshid=1xekecy13iinn,0,1282708537907523584,,,,en,"Toronto, Ontario",false,0,,,"<a href=""http://instagram.com"" rel=""nofollow"">Instagram</a>","Phoenix Beach camps in full swing now but a different set up this year. Coaches are on empty courts providing instruction, campers are social distancing, and lots of disinfecting! #staysafe #stayhealthy @… https://t.co/0hDiw8lh2c",https://twitter.com/phoenixtoronto/status/1282708537907523584,Thu Jul 25 00:10:48 +0000 2013,phoenixtoronto,false,Phoenix Volleyball Youth Club located in Toronto,78,425,246,3,"Toronto, Ontario",Phoenix Volleyball,phoenixtoronto,511,,http://phoenixvolleyball.ca,false
"-90.18940347,29.96542687",Mon Jul 13 16:15:24 +0000 2020,,,http://www.jeffparish.tv/live https://www.instagram.com/p/CClq8DplHB0/?igshid=1hi00y94dnddj,0,1282710226144198658,,,,en,"Elmwood, LA",false,0,,,"<a href=""http://instagram.com"" rel=""nofollow"">Instagram</a>",Parish President Cynthia Lee Sheng will provide an update on Jefferson Parish’s response to COVID-19 at a press conference today at 2 p.m. Tune in live on our Facebook page or at https://t.co/ozazNvyEwN. @ Jefferson… https://t.co/drkhe77LRO,https://twitter.com/JeffParishGov/status/1282710226144198658,Fri Oct 03 15:23:11 +0000 2014,JeffParishGov,false,Welcome to the official Twitter page for Jefferson Parish.,484,3210,153,66,"Jefferson, LA",Jefferson Parish,JeffParishGov,5450,,http://www.jeffparish.net/index.aspx?page=3747,false
"71.8346994,34.8295483",Mon Jul 13 16:49:05 +0000 2020,,,https://www.instagram.com/p/CCluyyfsmhk/?igshid=19jj516at27zm,1,1282718705911308291,,,,en,"North-west Frontier, Pakistan",true,0,,,"<a href=""http://instagram.com"" rel=""nofollow"">Instagram</a>","Hi Travelers ❤️
I am from Switzerland 🇨🇭, which is famous for mountains, lakes and valleys. 😍
After this pandemic i am planning for Pakistan 🇵🇰 (where is Swat in KPK known as Switzerland of Asia) for Autumn Season… https://t.co/bCs9UUeQpB",https://twitter.com/XploreworldPhy/status/1282718705911308291,Sat Aug 01 19:32:46 +0000 2015,XploreworldPhy,false,"P̺h̺y̺s̺i̺c̺i̺s̺t̺ 🌠📖 
T̺a̺u̺r̺u̺s̺ ♉ 📷 
T̺e̺a̺c̺h̺e̺r̺ 💞👩‍
T̺r̺a̺v̺e̺l̺l̺e̺r̺ 🌍 📷 
W̺a̺n̺t̺ t̺o̺ c̺a̺t̺c̺h̺ B̺e̺a̺u̺t̺y̺ o̺f̺ w̺h̺o̺l̺e̺ w̺o̺r̺l̺d̺ 🌌📷",1739,549,4238,2,"Punjab, Pakistan",Xploreworldbeauty,XploreworldPhy,4410,,,false
"28.1869,-25.7533",Mon Jul 13 16:03:01 +0000 2020,,,https://www.instagram.com/p/CClphb4MeQ2/?igshid=1knu09iy4hauu,0,1282707112813043713,,,,en,"Pretoria, South Africa",false,0,,,"<a href=""http://instagram.com"" rel=""nofollow"">Instagram</a>","Be aware of negative people they are more Dangerous than Corona Virus ❤️❤️ @ Pretoria, South Africa https://t.co/JvcJZnMHJA",https://twitter.com/Dj_Cooldogg/status/1282707112813043713,Mon Jun 01 18:03:41 +0000 2015,Dj_Cooldogg,false,Musician | Producer | CEO at Sekelekani Entertainment | Info Call: 0844373590 | Email rungobeni@gmail.com / bookings@sekelekani.co.za,79,193,345,0,Pretoria ,Rudolph_Sekelekaboy,Dj_Cooldogg,302,,http://www.sekelekaboy.co.za,false
"-96.70059112,33.07791998",Mon Jul 13 15:47:47 +0000 2020,covid19 fail fakepresident biden2020,,https://www.instagram.com/p/CClnx63B8cN/?igshid=13qp1zgbg9g4h,0,1282703279504396288,,,,en,"Plano, TX",true,0,,,"<a href=""http://instagram.com"" rel=""nofollow"">Instagram</a>","#covid19 #fail #fakepresident #biden2020 @ Chase Oaks, Plano, Texas https://t.co/DcnAXVTLZ8",https://twitter.com/williamliam/status/1282703279504396288,Fri Jun 05 01:58:40 +0000 2009,williamliam,false,"Socially awkward...very.  Hypothetically, if I were ever to have a headstone it would read “You Get What You Pay For”",1023,517,328,7,North Texas,William Maloney,williamliam,4062,,http://liamania.wordpress.com/,false
"-97.3358,37.6933",Mon Jul 13 14:58:43 +0000 2020,,,https://www.instagram.com/p/CCliKYhpA4W/?igshid=hnm4g8t8uruu,0,1282690931334971397,,,,en,"Wichita, KS",false,0,,,"<a href=""http://instagram.com"" rel=""nofollow"">Instagram</a>","One like equals one treat that I will give him when I get home from work 📷@KatelinRunsFast @ Wichita, Kansas https://t.co/23AWThE5MB",https://twitter.com/IanWoods316/status/1282690931334971397,Mon Mar 05 16:40:49 +0000 2012,IanWoods316,false,super edgy bio,10488,526,567,3,Yote House,Ya Local Introvert,IanWoods316,10224,,http://toohardtokeep.blogspot.com/,false
"-90.08531,29.86894",Mon Jul 13 15:15:15 +0000 2020,PPE,,https://www.instagram.com/p/CClkDdKlVXF/?igshid=bh4urial64a2,0,1282695089228328961,,,,en,"Woodmere, LA",false,0,,,"<a href=""http://instagram.com"" rel=""nofollow"">Instagram</a>","We are starting tomorrow!  In gym session is limited space so don’t wait only a few more available!  Cash app confirms spot. In gym #PPE mask and batting gloves, online minimal equipment required (weights, resistance… https://t.co/WenuEgCYqb",https://twitter.com/livelyfenmotion/status/1282695089228328961,Sun Sep 24 02:56:43 +0000 2017,livelyfenmotion,false,,15,25,32,0,"Woodmere, LA",Miapatrice,livelyfenmotion,1279,,,false
"-85.88310701,37.72971543",Mon Jul 13 16:48:33 +0000 2020,,https://twitter.com/Insure_Kentucky/status/1282718570925838336/photo/1,https://www.kentucky.com/news/politics-government/article244152672.html?utm_source=dlvr.it&utm_medium=twitter#storylink=rss,0,1282718570925838336,,,,en,"Elizabethtown, KY",false,1,,,"<a href=""https://dlvrit.com/"" rel=""nofollow"">dlvr.it</a>",Free Insurance Quote Court of Appeals declines to stop judges’ rulings against Beshear’s COVID-19 orders https://t.co/otS5rfhXKw Call 270-360-9600 https://t.co/t5HzXEIlRR,https://twitter.com/Insure_Kentucky/status/1282718570925838336,Tue Sep 25 16:52:05 +0000 2018,Insure_Kentucky,false,"Olsommer-Clarke Insurance Group, your hometown choice in Elizabethtown and all of Central Kentucky. “Our service shines above the rest” Call 270-360-9600",0,676,26,1,"Elizabethtown, Kentucky",Olsommer-Clarke Kentucky,Insure_Kentucky,3736,,https://kentucky.olsommerclarke.com/,false
"-76.614,39.2944",Mon Jul 13 16:37:28 +0000 2020,,,https://www.instagram.com/p/CCltdh7Jp25/?igshid=tb2z5m2wk5tq,1,1282715778949816320,,,,en,"Baltimore, MD",false,0,,,"<a href=""http://instagram.com"" rel=""nofollow"">Instagram</a>","Doing my best to navigate through COVID-19 and dismantling systematic racism. I don't have all the answers, but I'm trying to make sense of everything and do my part.
•
What I've realized is that, talking to my… https://t.co/bHnvhLazNG",https://twitter.com/THEREAL_IME/status/1282715778949816320,Mon Sep 14 02:10:43 +0000 2009,THEREAL_IME,false,"I'm from Baltimore, and now I'm cool because I have a Twitter",82,112,206,0,"Oakland, CA",Ime Umoh,THEREAL_IME,1049,,,false
"-122.3308,47.6046",Mon Jul 13 16:00:51 +0000 2020,,,https://www.instagram.com/p/CCloevJg12R/?igshid=1iw0cm9yz7in9,0,1282706564026073088,,,,en,"Seattle, WA",false,0,,,"<a href=""http://instagram.com"" rel=""nofollow"">Instagram</a>","So, I have been working on a series on the way people are finding and spreading joy in the era of coronavirus. No one wanted to publish it but I wanted to share some of the stories I found. First up, the “Quarantine… https://t.co/uQ5VESPgI7",https://twitter.com/hip_photo/status/1282706564026073088,Wed Mar 02 07:42:45 +0000 2011,hip_photo,false,"Photographer based in Seattle, WA. My first book, “80s Redux” (Schiffer Publishing) available everywhere now: https://t.co/NnAxprhLek",35,185,472,5,"Seattle, WA",Mike Hipple Photo,hip_photo,562,,http://www.hipphoto.com,false
"7.26319444,9.00680556",Mon Jul 13 16:25:21 +0000 2020,,,https://www.instagram.com/p/CClsEwxHBvG/?igshid=1s7qcvcyyww3m,0,1282712729531318285,,,,en,"Federal Capital Territory, Nigeria",false,0,,,"<a href=""http://instagram.com"" rel=""nofollow"">Instagram</a>","Inspection at the Nnamdi Azikiwe International Airport,  with the Managing Director of FAAN and The Airport regional manager. The airport is ready  with Federal government compliance of covid 19 regulations and… https://t.co/lYiaENjc1N",https://twitter.com/AkotexElevator/status/1282712729531318285,Fri Jul 24 17:40:53 +0000 2009,AkotexElevator,false,"elevators & escalator, real estate, IT fintech (: #AkotexGroup Trust Me, I'm an Engineer# and Tech is what I love #Forbes30under30",1128,431,675,6,Nigeria,AkotexElevators,AkotexElevator,5062,,http://www.akotexgroup.com,false
"-81.875298,26.636909",Mon Jul 13 15:26:00 +0000 2020,Florida Covid facemask,,https://www.instagram.com/p/CCllSRSAPFz/?igshid=mixorpzisuj9,0,1282697796395708416,,,,en,"Fort Myers, FL",false,1,,,"<a href=""http://instagram.com"" rel=""nofollow"">Instagram</a>","Hey everybody, here is your friendly reminder to wear a face mask! In #Florida in particular, the number of cases of #Covid is rising. Please wear your #facemask not only to protect yourself, but also to demonstrate… https://t.co/uJ5VuinQh5",https://twitter.com/staceybrownlmhc/status/1282697796395708416,Thu Jun 25 03:45:52 +0000 2015,staceybrownlmhc,false,"Helping folks live well with #adhd, #anxiety and #depression in #FortMyers, #Florida.  Consultant, Educator, Writer, Clinical Supervisor #MentalHealth",256,178,308,33,"Fort Myers, FL",Stacey C. Brown,staceybrownlmhc,2147,,http://www.staceybrowncounseling.com,false
"-111.89323042,40.76317729",Mon Jul 13 16:32:18 +0000 2020,,,https://www.instagram.com/p/CCls33rBHE0/?igshid=96f5xp0bdtse,1,1282714481261510657,,,,en,"Salt Lake City, UT",false,0,,,"<a href=""http://instagram.com"" rel=""nofollow"">Instagram</a>",I made it to Round 2 of the U92 hip hop lockdown edition battle. That means it’s that time again. GO VoTE FOR MY VIDEO PLEASE. You can vote any day and every day. Link in the description. @ Broadway Media https://t.co/YMy4mMUqFS,https://twitter.com/club_masters/status/1282714481261510657,Tue Aug 30 02:11:07 +0000 2011,club_masters,false,I just got out of a really intense soul bond.,5786,237,898,8,"Salt Lake City, UT",Joaquin Galvan,club_masters,12174,,http://kino.bandzoogle.com,false
"-118.79923186,33.9998627",Mon Jul 13 15:19:04 +0000 2020,,,http://dlvr.it/RbX4fq,0,1282696051443425286,,,,en,"California, USA",false,0,,,"<a href=""https://dlvrit.com/"" rel=""nofollow"">dlvr.it</a>","Olivia Culpo, Kate Bock, Jasmine Sanders Shot SI Swim Before COVID Ruined Everything https://t.co/frjq2Qz5BD (vía TMZ)",https://twitter.com/chismetime/status/1282696051443425286,Mon Nov 23 06:00:07 +0000 2009,chismetime,false,"Spanish & English gossip news / chismes. I love all chismes! (sources: TMZ, PerezHilton, En el Brasero and mx hola! we added +news/noticias (El Universal) xx",1,276,12,5,Your tongue,Chisme Time,chismetime,208114,,https://www.facebook.com/chismetimeone,false
"-117.5655,33.8752",Mon Jul 13 15:22:10 +0000 2020,,,,0,1282696832674598912,,,,en,"Corona, CA",,0,,,"<a href=""http://towntweet.com/"" rel=""nofollow"">TownTweet</a>",Corona CA Mon Jul 13th AM Forecast: TODAY Mostly Sunny Hi 97 TONIGHT Mostly Clear Lo 62,https://twitter.com/CoronaCA_/status/1282696832674598912,Sun Aug 14 04:14:56 +0000 2011,CoronaCA_,false,"Follow us for the latest news, weather, events and emergency notices for Corona, CA",0,436,0,5,"Corona, CA","Corona, California",CoronaCA_,4337,,http://countyca.net/riverside/corona/,false
"-97.7475,30.2677",Mon Jul 13 16:42:36 +0000 2020,TaxNews IRS Texas Utah Covid19,,https://www.instagram.com/p/CCluDTOHkij/?igshid=1ku1h56i68kf2,0,1282717070656970753,,,,en,"Austin, TX",false,0,,,"<a href=""http://instagram.com"" rel=""nofollow"">Instagram</a>","#TaxNews: The #IRS has recalled workers in some states, including #Texas and #Utah, that have seen spikes in #Covid19 cases since reopening.
⠀⠀⠀⠀⠀⠀⠀⠀⠀
➡️The National Treasury Employees Union, which represents… https://t.co/s3zgY6bg0K",https://twitter.com/GuillenPujolCPA/status/1282717070656970753,Tue Sep 16 10:12:30 +0000 2014,GuillenPujolCPA,false,Full-service #accounting firm specialized in #internationaltax & #businessconsulting within reach of all-size businesses. #SeHablaEspañol,0,158,0,14,"Miami, FL",Guillen Pujol CPAs,GuillenPujolCPA,2095,,https://guillenpujol.com/blog/,false
"-75.3198353,39.97095712",Mon Jul 13 16:32:16 +0000 2020,,,http://www.woodenindiantobacco.com https://www.instagram.com/p/CCls3l0HMrO/?igshid=1v6doey8yh349,0,1282714473036423174,,,,en,"Pennsylvania, USA",false,1,,,"<a href=""http://instagram.com"" rel=""nofollow"">Instagram</a>","You've had the toro, now it's time to try the brand new corona gorda, HVC 500 Selectos! Available online at https://t.co/Ho8O1b5A8r and at the shop. 

Don't miss out on this Nicaraguan puro! This medium/full… https://t.co/Um2TKGmEJS",https://twitter.com/WoodenIndian/status/1282714473036423174,Tue Jul 20 19:40:50 +0000 2010,WoodenIndian,false,The Wooden Indian Tobacco Shop strives to promote the cigar culture through education and a friendly place to smoke.,0,240,99,5,"Havertown, PA",Wooden Indian,WoodenIndian,183,,http://www.woodenindiantobacco.com,false
"-99.13547516,19.43757829",Mon Jul 13 15:02:32 +0000 2020,,,http://dlvr.it/RbX15B,0,1282691890622545920,,,,en,"Cuauhtémoc, Distrito Federal",false,1,,,"<a href=""https://dlvrit.com/"" rel=""nofollow"">dlvr.it</a>","Stigmabase —  Health during pandemic, racial inequity may drive Latinx vote: Immigrants held in detention, the impact of COVID-19 on immigrants, the Latinx vote, and the appeal of Biden are analyzed by Latinx leader María ... View article... https://t.co/zHmI9I5eXG",https://twitter.com/PairsonnalitesE/status/1282691890622545920,Fri Sep 03 15:34:08 +0000 2010,PairsonnalitesE,false,Español - Português | Keeping up-to-date on global exclusion — Stigmabase is an internet non-profit Initiative,0,1979,894,154,Las Américas | España,Stigmabase | ES,PairsonnalitesE,920058,,https://edu.stigmabase.org/,false
"-122.43317,45.49925",Mon Jul 13 16:32:25 +0000 2020,,,https://www.instagram.com/p/CClsucmFTgU/?igshid=9fp98jub5iqv,0,1282714511485566976,,,,en,"Gresham, OR",false,0,,,"<a href=""http://instagram.com"" rel=""nofollow"">Instagram</a>","How To Keep Your Vehicle Sanitized For Your Family’s Protection

During the Covid-19, everyone has been cleaning and sanitizing our hands, door knobs, glasses, countertops, tables &amp; chairs.  But do you think about… https://t.co/YA6VCYmm93",https://twitter.com/AllAboutAutoOR/status/1282714511485566976,Tue Sep 08 16:44:27 +0000 2009,AllAboutAutoOR,false,"All About Automotive is an automotive service and repair facility in Gresham, Oregon. We treat your car as if it were our own!",0,49,5,1,"Gresham, Oregon",All About Automotive,AllAboutAutoOR,406,,http://allaboutautomotive.com,false
"-71.11458515,42.2752011",Mon Jul 13 15:39:03 +0000 2020,,,https://www.instagram.com/p/CClmsN_H57k/?igshid=wkcw9ckpy1s5,0,1282701080674152451,,,,en,"Boston, MA",true,0,,,"<a href=""http://instagram.com"" rel=""nofollow"">Instagram</a>","Life WAS great until our world got hit by Coronavirus COVID-19 and we sat home, ATE JUNK FOOD 🍔 and LAID DOWN! 🛋 AND WATCHED NETFLIX 💻 or PLAYED VIDEO GAMES 🎮 ALL DAY 🌎 No: exercise, fruits, or enough water, and… https://t.co/M3dj1VDsNN",https://twitter.com/protagonist52/status/1282701080674152451,Sat Apr 04 17:02:39 +0000 2009,protagonist52,false,🎮Gamer|⚾️Boston Sports Fan|🎤Rapper|💈Barber|🎓Mathematician|✖️➗➖➕Math Teacher|🔊Audio Engineer|🏋🏾‍♂️Gym Rat|🚗🚦Uber Driver|🍺🍾Bartender|🧸Toy Collector,520,579,403,7,"Boston, MA",SuperKev the MathMagician,protagonist52,2719,,http://www.instagram.com/protagonist52,false
"1.3791,51.38692",Mon Jul 13 15:38:50 +0000 2020,fatskeleton chooseyourmasques Covid19 Besafe StaySafe Stayhome Socialdistancing Selfisolation Mymaskprotectsyouyourmaskprotectsme,,https://www.instagram.com/p/CClmwFIhsUy/?igshid=8ukqrpij4t1c,0,1282701023820185600,,,,en,"Margate, England",false,0,,,"<a href=""http://instagram.com"" rel=""nofollow"">Instagram</a>","""It's A Mixed Up Muddled Up Shook Up World!"" x #fatskeleton #chooseyourmasques #Covid19 #Besafe #StaySafe #Stayhome #Socialdistancing #Selfisolation #Mymaskprotectsyouyourmaskprotectsme @ Margate, Kent https://t.co/vfA4xX68bE",https://twitter.com/wid0025/status/1282701023820185600,Thu Apr 11 23:47:12 +0000 2013,wid0025,false,"""It's Not Easy Being Green!"" x",2753,56,68,5,Always Headin South! ;-},Steve Willey,wid0025,3336,,,false
"-0.7594,52.0406",Mon Jul 13 16:49:47 +0000 2020,,,https://www.instagram.com/p/CCluHs7j-Kx/?igshid=1375mmn98ir09,0,1282718878573920256,,,,en,"Milton Keynes, England",false,0,,,"<a href=""http://instagram.com"" rel=""nofollow"">Instagram</a>","The Post-Lockdown Package 💦💦We’ve created you the U L T I M A T E package to help you shed off those extra inches which have crept up on you over lockdown and get you feeling like yourself again! 🍎💫 
.
.
This… https://t.co/7GjpwZVHQF",https://twitter.com/MKNonSurgical/status/1282718878573920256,Mon Sep 04 07:26:39 +0000 2017,MKNonSurgical,false,The No.1 Non-Surgical Body Enhancement Clinic.,124,282,1134,2,"Milton Keynes, England",Nue Clinic,MKNonSurgical,60,,http://www.nueclinic.co.uk,false
"88.70593071,26.72038083",Mon Jul 13 16:32:06 +0000 2020,,,https://www.instagram.com/p/CCls2Vtn_Ar/?igshid=pm72sj8b8gze,0,1282714428958478338,,,,en,"Jalpaiguri, India",false,0,,,"<a href=""http://instagram.com"" rel=""nofollow"">Instagram</a>","Most coronavirus deaths.

US: 137,700
Brazil: 72,151
UK: 44,819
Mexico: 35,006
Italy: 34,954
France: 30,004
Spain: 28,403
India: 23,200
Iran: 13,032
Peru: 11,870
Russia: 11,439
Belgium: 9,782
Germany: 9,135
Canada:… https://t.co/VLEOKBWN7D",https://twitter.com/mdabdullasiddi3/status/1282714428958478338,Mon Oct 31 19:47:44 +0000 2016,mdabdullasiddi3,false,"Kranti, Mal, Jalpaiguri",5420,130,1513,0,"Mal, India",Md Abdulla Siddiki,mdabdullasiddi3,582,,http://www.mdabdulla.com,false
"77,21",Mon Jul 13 16:18:40 +0000 2020,,,https://wa.me/917982467763 https://www.instagram.com/p/CClnNOmBw6M/?igshid=9cx5xbkidlup,0,1282711050681495554,,,,en,"Maharashtra, India",false,0,,,"<a href=""http://instagram.com"" rel=""nofollow"">Instagram</a>","FREE Digital Marketing Service Covid19
Limited Offer So HurryUp
If any Query https://t.co/n8UBzelW9F @ India https://t.co/HWHEK2Wl7T",https://twitter.com/Star69508171/status/1282711050681495554,Wed May 06 20:02:26 +0000 2020,Star69508171,false,Facebook ads / Google ads/ Instagram ads,38,5,14,0,"New Delhi, India",Digital Marketing Service Covid19,Star69508171,66,,https://wa.me/917982467763,false
"-0.13608912,51.50413561",Mon Jul 13 15:04:33 +0000 2020,,,http://dlvr.it/RbX1WK,0,1282692399559409665,,,,en,"London, England",false,1,,,"<a href=""https://dlvrit.com/"" rel=""nofollow"">dlvr.it</a>","Digital Landscape: HIV Market 2020 Forecast to 2026 (Based on 2020 COVID-19 Worldwide ...: The research mainly covers Digital Landscape: HIV Market in North America (Canada, Mexico, and the United States), Europe industry (UK, Germany, ... https://t.co/o6m6XiMZp7",https://twitter.com/Pairsonnalites/status/1282692399559409665,Thu Apr 29 13:56:48 +0000 2010,Pairsonnalites,false,Americas — United Kingdom  | Keeping up-to-date on global exclusion — Stigmabase is an internet non-profit Initiative,0,4213,3910,271,Americas | United Kingdom,Stigmabase | ORG,Pairsonnalites,1648479,,https://edu.stigmabase.org/,false
"-0.12842417,51.50883261",Mon Jul 13 15:08:45 +0000 2020,tizianovecellio London,,https://www.instagram.com/p/CCljT0dlnkL/?igshid=1tri97o9xzlja,1,1282693455391723520,,,,en,"London, England",false,0,,,"<a href=""http://instagram.com"" rel=""nofollow"">Instagram</a>","Aihme, #tizianovecellio: ma come mai mi commuovi come nessun’altro pittore? Perhaps it was because it’s the first time I have been to #London’s nationalgallery since it reopened post-lockdown and the new,… https://t.co/OXFqZUtDqG",https://twitter.com/rosfurness/status/1282693455391723520,Tue Jul 21 11:18:08 +0000 2015,rosfurness,false,,7075,740,870,14,"London, England",Rosalind Furness,rosfurness,1580,,,false
"-80.25335,26.25416",Mon Jul 13 15:48:54 +0000 2020,,,https://www.instagram.com/p/CCln54zlbj0/?igshid=1gu4moe9no5qz,0,1282703557242892289,,,,en,"Coral Springs, FL",false,0,,,"<a href=""http://instagram.com"" rel=""nofollow"">Instagram</a>","According to the National Association of Realtors (NAR), 54% of Buyers and 62% of Sellers strongly agree that a real estate agent’s guidance matters more than ever, especially during the pandemic our country has… https://t.co/1T0TFGdTBq",https://twitter.com/mmello1/status/1282703557242892289,Sat Apr 11 18:43:08 +0000 2009,mmello1,false,Your best bet when buying or selling Real Estate in Florida!!,337,1013,99,25,"Miami, FL",Marco Mello RE/MAX,mmello1,297,,http://www.MarcoMello.com,false
"22.03091263,-33.22611051",Mon Jul 13 15:13:21 +0000 2020,,,https://www.instagram.com/p/CClj1cGJI5n/?igshid=ck2g83l925to,0,1282694612885270528,,,,en,South Africa,false,0,,,"<a href=""http://instagram.com"" rel=""nofollow"">Instagram</a>","The corona breeze has affected our pizza special, so no more beer or wine. But we’re working on a new sweet deal starting tomorrow. Details to follow.
To tantalize your taste buds we are proud to launch a gluten free… https://t.co/gxZsqxs2zE",https://twitter.com/africanrelish/status/1282694612885270528,Fri Jun 19 19:19:43 +0000 2009,africanrelish,false,"A recreational cooking school, restaurant, deli & accommodation. Prince Albert, Karoo. Celebrating local. Winner - Best Cooking School FOODTREKKING AWARDS 2018",2295,2665,2694,76,Prince Albert,African Relish,africanrelish,5394,,https://www.africanrelish.com/accommodation/,false
